task_id,title,user_id,completed
1,delectus aut autem,1,False
2,quis ut nam facilis et officia qui,1,False
3,fugiat veniam minus,1,False
5,laboriosam mollitia et enim quasi adipisci quia provident illum,1,False
6,qui ullam ratione quibusdam voluptatem quia omnis,1,False
7,illo expedita consequatur quia in,1,False
9,molestiae perspiciatis ipsa,1,False
13,et doloremque nulla,1,False
18,dolorum est consequatur ea mollitia in culpa,1,False
21,suscipit repellat esse quibusdam voluptatem incidunt,2,False
23,et itaque necessitatibus maxime molestiae qui quas velit,2,False
24,adipisci non ad dicta qui amet quaerat doloribus ea,2,False
28,nesciunt totam sit blanditiis sit,2,False
29,laborum aut in quam,2,False
31,repudiandae totam in est sint facere fuga,2,False
32,earum doloribus ea doloremque quis,2,False
33,sint sit aut vero,2,False
34,porro aut necessitatibus eaque distinctio,2,False
37,sunt cum tempora,2,False
38,totam quia non,2,False
39,doloremque quibusdam asperiores libero corrupti illum qui omnis,2,False
41,aliquid amet impedit consequatur aspernatur placeat eaque fugiat suscipit,3,False
42,rerum perferendis error quia ut eveniet,3,False
45,velit soluta adipisci molestias reiciendis harum,3,False
46,vel voluptatem repellat nihil placeat corporis,3,False
47,nam qui rerum fugiat accusamus,3,False
48,sit reprehenderit omnis quia,3,False
49,ut necessitatibus aut maiores debitis officia blanditiis velit et,3,False
51,distinctio exercitationem ab doloribus,3,False
52,nesciunt dolorum quis recusandae ad pariatur ratione,3,False
53,qui labore est occaecati recusandae aliquid quam,3,False
57,pariatur et magnam ea doloribus similique voluptatem rerum quia,3,False
58,est dicta totam qui explicabo doloribus qui dignissimos,3,False
59,perspiciatis velit id laborum placeat iusto et aliquam odio,3,False
62,et placeat et tempore aspernatur sint numquam,4,False
64,voluptas consequatur qui ut quia magnam nemo esse,4,False
65,fugiat pariatur ratione ut asperiores necessitatibus magni,4,False
66,rerum eum molestias autem voluptatum sit optio,4,False
67,quia voluptatibus voluptatem quos similique maiores repellat,4,False
68,aut id perspiciatis voluptatem iusto,4,False
69,doloribus sint dolorum ab adipisci itaque dignissimos aliquam suscipit,4,False
70,ut sequi accusantium et mollitia delectus sunt,4,False
71,aut velit saepe ullam,4,False
72,praesentium facilis facere quis harum voluptatibus voluptatem eum,4,False
74,expedita tempore nobis eveniet laborum maiores,4,False
75,occaecati adipisci est possimus totam,4,False
77,maiores aut nesciunt delectus exercitationem vel assumenda eligendi at,4,False
78,reiciendis est magnam amet nemo iste recusandae impedit quaerat,4,False
82,voluptates eum voluptas et dicta,5,False
84,sunt veritatis ut voluptate,5,False
88,vitae aut excepturi laboriosam sint aliquam et et accusantium,5,False
94,facilis modi saepe mollitia,5,False
96,nobis suscipit ducimus enim asperiores voluptas,5,False
97,dolorum laboriosam eos qui iure aliquam,5,False
99,neque voluptates ratione,5,False
100,excepturi a et neque qui expedita vel voluptate,5,False
101,explicabo enim cumque porro aperiam occaecati minima,6,False
102,sed ab consequatur,6,False
103,non sunt delectus illo nulla tenetur enim omnis,6,False
104,excepturi non laudantium quo,6,False
107,praesentium facilis omnis laudantium fugit ad iusto nihil nesciunt,6,False
111,magni accusantium labore et id quis provident,6,False
112,consectetur impedit quisquam qui deserunt non rerum consequuntur eius,6,False
113,quia atque aliquam sunt impedit voluptatum rerum assumenda nisi,6,False
114,cupiditate quos possimus corporis quisquam exercitationem beatae,6,False
115,sed et ea eum,6,False
117,sequi quae est et qui qui eveniet asperiores,6,False
118,quia modi consequatur vero fugiat,6,False
119,corporis ducimus ea perspiciatis iste,6,False
120,dolorem laboriosam vel voluptas et aliquam quasi,6,False
123,esse et quis iste est earum aut impedit,7,False
124,qui consectetur id,7,False
125,aut quasi autem iste tempore illum possimus,7,False
128,eius omnis est qui voluptatem autem,7,False
129,rerum culpa quis harum,7,False
131,qui ea incidunt quis,7,False
134,molestiae doloribus et laborum quod ea,7,False
135,facere ipsa nam eum voluptates reiciendis vero qui,7,False
136,asperiores illo tempora fuga sed ut quasi adipisci,7,False
137,qui sit non,7,False
139,consequatur doloribus id possimus voluptas a voluptatem,7,False
143,eum non recusandae cupiditate animi,8,False
144,ut eum exercitationem sint,8,False
145,beatae qui ullam incidunt voluptatem non nisi aliquam,8,False
148,esse quas et quo quasi exercitationem,8,False
149,animi voluptas quod perferendis est,8,False
150,eos amet tempore laudantium fugit a,8,False
152,odit eligendi recusandae doloremque cumque non,8,False
153,ea aperiam consequatur qui repellat eos,8,False
160,et praesentium aliquam est,8,False
163,natus corrupti maxime laudantium et voluptatem laboriosam odit,9,False
164,reprehenderit quos aut aut consequatur est sed,9,False
165,fugiat perferendis sed aut quidem,9,False
166,quos quo possimus suscipit minima ut,9,False
167,et quis minus quo a asperiores molestiae,9,False
168,recusandae quia qui sunt libero,9,False
170,quisquam aliquam quia doloribus aut,9,False
172,et provident amet rerum consectetur et voluptatum,9,False
173,harum ad aperiam quis,9,False
174,similique aut quo,9,False
176,magni soluta corrupti ut maiores rem quidem,9,False
177,et placeat temporibus voluptas est tempora quos quibusdam,9,False
181,ut cupiditate sequi aliquam fuga maiores,10,False
184,molestias modi perferendis perspiciatis,10,False
185,voluptates dignissimos sed doloribus animi quaerat aut,10,False
186,explicabo odio est et,10,False
187,consequuntur animi possimus,10,False
192,ut quas possimus exercitationem sint voluptates,10,False
194,sed ut vero sit molestiae,10,False
200,ipsam aperiam voluptates qui,10,False
